sid	text
35.disable spawner 4	These teleporters seem to be everywhere!
35.this is the last	This may be the last one. It seems we’ve reached some kind of checkpoint.
	
35.describe situation	There is a teleportation pad here but the controls are somewhere behind the shield, that only Jaar Lash can pass through.
35.we have a plan	Our only option: Tharksh enter, find the controls and teleport us inside.
35.jaar lash units	Tharksh can take Jaar Lash units with him.
35.we wait-35	OK then, the rest of us will have to wait here.
35.dont like	I don’t like the idea of splitting our forces right now.
35.no choice	We have no choice.
	
35.teleporter controls	Tharksh thinks these are the controls for the teleporter. He must activate it while he is still alive!
	
35.disable spawner 5	We shouldn’t leave an enabled teleporter behind us!
35.fast enough	Tharksh will disable the teleporter fast enough.
	
35.dead end	A dead end!
35.enable teleporter	There is a teleporter here but we must eliminate the defenses to reach the control device.
	
35.spawner 5 disabled	This receiver is disabled.
35.hurry-35	We also shouldn’t waste time.
35.done	OK, let’s move on.
	
	
//// Mission 3.6	
	
36.do you sense	Eji, is this the right direction? Do you sense the Psi Resonator?
36.too far	Yes, the direction is right. I hear the song faintly but I’m too far to connect to the machine.
36.find spot	Then move on until we’re close enough.
	
36.found spot	I think I’m close enough. The alien is already singing to the Shard! We must hurry!
36.get him	This battle is yours only, Eji. We can’t help you fight it but we will protect you with our lives.
36.concentration	His mind is... very strong. I’ll need full concentration.
36.guard eji	It seems the link to the Resonator physically protects Eji. Nevertheless, we should guard her from attacks or she will lose concentration.
36.attack alien	It may also be a good idea to find and attack their psychic to disrupt <i>his</> concentration.
	
36.it is done	It is done.
36.shard changing	Look! The Shard is changing!
	
36.too strong	He’s too strong... Can’t... hold... him...
36.eji no	Eji! No!
	
//// Special Location BSA	
	
bsa.greetings	Ladieees and Gentlemeeeen!! The graaaaand prize of the Saling Blood Sport Arena!!
	
bsa.enter arena	Contestants! Prepare for battle and enter the arena if you dare!
	
bsa.yamu coming	Now face the wrath of mighty Battle Yamu!
	
bsa.horror coming	Tremble before the fury of the Reptile!
bsa.reptile wins	Reptile wins!
	
bsa.wave1	The beast is beaten! He was one verrry big and stupid target. NOW! Let’s see how you do with well trained warriors!
	
bsa.wave2	Now to add blade-swinging and rocket-spitting machines to the mix!
	
bsa.wave3	Wowee! Good job! Real progress!  But we are nasty so we’re throwin’ everything we’ve got at you now – even officers!
	
bsa.wave4	Bah... let’s wrap it up  – bring in the Hellfires!
	
bsa.clear arena	Contestants, clear the arena!
	
bsa.warning1	Warning, contestants! Clear arena immediately!
	
bsa.warning2	Second warning: Leave the arena or be shot!
	
bsa.kill them	OK, guys, give ’em the ticket!
	
bsa.give sign	Contestants! Prepare for battle and give us a sign when ready!
bsa.yamu hit	Ouch! That will surely make a scar! Or just a wet spot in the dirt!
bsa.yamu dead	Watch out! The Battle Yamu is going to fall! Wow, that was one giant piece of meat... and crystals!
bsa.reptile dead	What a slimy thing it was.
bsa.monster killed	Applause for the monster slayers! Now we will take a short break for our heroes to regroup and prepare for the challenges ahead.
bsa.final battle-bsa	Astonishing performance! Contestants, regroup and give us a sign when you are ready for the final battle!
bsa.claim prize	Amazing! Ladies and gentleman, I present to you the winners of the grand prize of the Saling blood sport arena! Contestants, claim your prize!
//// Special Location ROM	
	
rom.intruders	I am detecting intruders! Call my shuttle immediately!
rom.hurry-rom	They found us! Hurry!
rom.hurry-rom	They found us! Hurry!
rom.hurry-rom	They found us! Hurry!
	
rom.shuttle arrived	My shuttle is here! Blow up the corridors!
	
rom.boss seen	I have a bad feeling about this.
rom.boss seen	I have a bad feeling about this.
rom.boss seen	I have a bad feeling about this.
	
rom.cancel shuttle	Cancel the shuttle! I will deal with the intruders myself!
	
rom.activate cannon	This shell is useless now. Activate the cannon!
rom.deactivate cannon	Deactivate the damn cannon now? Great!!
rom.deactivate cannon	Deactivate the damn cannon now? Great!!
rom.deactivate cannon	Deactivate the damn cannon now? Great!!
	
rom.reinforcements	We have a teleportation signal! We can call reinforcements.
rom.reinforcements	We have a teleportation signal! We can call reinforcements.
rom.reinforcements	We have a teleportation signal! We can call reinforcements.
	
	
//// Special Location Junkyard	
	
junkyard.intruders	Intruders detected! Move everything valuable to the shelters!
junkyard.hurry-junkyard	Come on! Let’s see what these rusty cans are hiding!
junkyard.hurry-junkyard	Come on! Let’s see what these rusty cans are hiding!
junkyard.hurry-junkyard	Come on! Let’s see what these rusty cans are hiding!
	
junkyard.ported on time	Made it! Follow me, I see something big on the beach.
junkyard.ported on time	Made it! Follow me, I see something big on the beach.
junkyard.ported on time	Made it! Follow me, I see something big on the beach.
	
junkyard.late with port	We are too late! They have hidden the goodies!
junkyard.late with port	We are too late! They have hidden the goodies!
junkyard.late with port	We are too late! They have hidden the goodies!
	
junkyard.reinforcements	We have a teleportation signal! We can call reinforcements!
junkyard.reinforcements We have a teleportation signal! We can call reinforcements!
junkyard.reinforcements	We have a teleportation signal! We can call reinforcements!
	
junkyard.kirxxa dead	My pet! You shouldn’t have touched Kirxxa, intruders!
	
junkyard.gorgar will eat you	Gorgar will eat you!
	
junkyard.gorgar dead	Gorgar has fallen! This is getting out of hand!
	
junkyard.coming	It’s your last chance to turn back, intruders. I’m coming for you!
	
junkyard.call technicians	Technicians, activate the bot production facilities!
	
junkyard.a-bot wave	I need reinforcements!
	
junkyard.nomad wave	Second-level reinforcements, engage!
	
junkyard.machines wave	Activate all emergency reinforcements!
	
junkyard.ditz dies no xessk	Core functions terminating...
	
junkyard.ditz dies xessk spawns	Release Xessk, let him avenge Kirxxa! Core functions terminating...
	
	
//// Special Location DTB	
	
dtb.lets move	Proceed with caution!
dtb.lets move	Proceed with caution!
dtb.lets move	Proceed with caution!
	
dtb.at cages	Creature cages! If we open them, we better be prepared to face whatever comes out.
dtb.at cages	Creature cages! If we open them, we better be prepared to face whatever comes out.
dtb.at cages	Creature cages! If we open them, we better be prepared to face whatever comes out.
	
dtb.cages done	This should be over soon.
dtb.cages done	This should be over soon.
dtb.cages done	This should be over soon.
	
dtb.at adam	Poor creature. Let’s put it out of its misery!
dtb.at adam	Poor creature. Let’s put it out of its misery!
dtb.at adam	Poor creature. Let’s put it out of its misery!
	
dtb.got company	Father, we have company!
dtb.entertain guests	Would you entertain our guests for me, Adam?
dtb.come to adam	Heheh, yes, father! Come, guests, let’s have fun!
	
dtb.you killed frank	You killed my father! You will pay!
	
dtb.adam dead	Suffer no longer, poor creature.
dtb.adam dead	Suffer no longer, poor creature.
dtb.adam dead	Suffer no longer, poor creature.
dtb.you killed adam	Murderers! What has my Adam done to you? Come! I await you!
	
dtb.at frank	We have found their commander. Let’s waste him!
dtb.at frank	We have found their commander. Let’s waste him!
dtb.at frank	We have found their commander. Let’s waste him!
	
dtb.adam watch me	You dare challenge me? Watch me wipe the floor with these fools, Adam!
	
dtb.revenge for adam	Your last mistake! Time for revenge!!
	
dtb.frank dead	Good job! We just made the world a little better.
dtb.frank dead	Good job! We just made the world a little better.
dtb.frank dead	Good job! We just made the world a little better.
dtb.come try me	What do you think you’re doing?! This I won't tolerate! Think you’re so tough? Try me if you dare!
dtb.will come	How could we refuse such an invitation? We're looking forward to seeing your ugly face!
dtb.will come	How could we refuse such an invitation? We're looking forward to seeing your ugly face!
dtb.will come	How could we refuse such an invitation? We're looking forward to seeing your ugly face!
	
	
//// Special Location Safari	
	
safari.explore	Keep your eyes peeled, One small mistake and you’re dead.
safari.explore	Keep your eyes peeled, One small mistake and you’re dead.
safari.explore	Keep your eyes peeled, One small mistake and you’re dead.
	
safari.kill queen	This is what I call big prey. Now let’s kill it!
safari.kill queen	This is what I call big prey. Now let’s kill it!
safari.kill queen	This is what I call big prey. Now let’s kill it!
	
safari.killed queen	A glorious kill!
safari.killed queen	A glorious kill!
safari.killed queen	A glorious kill!
	
safari.kill mech0	It is just a machine, we can take it down!
safari.kill mech0	It is just a machine, we can take it down!
safari.kill mech0	It is just a machine, we can take it down!
	
safari.killed mech0	Aaand down it goes!
safari.killed mech0	Aaand down it goes!
safari.killed mech0	Aaand down it goes!
	
safari.jack in combat	Now the hunters become the hunted!!
	
safari.jack dead	Impossible! I have been defeated! So be it, doors to Bill are unlocked now, go challenge him if you dare!
	
safari.at bill	The final challenge! We can do it!
safari.at bill	The final challenge! We can do it!
safari.at bill	The final challenge! We can do it!
	
safari.bill in combat	Aargh, more brave hunters waiting for me to kill! Okay, okay, I kill!
	
safari.bill dead	Aaaargh, no!
	
	
//// Special Location Kharum	
	
kharum.help village	The villagers will need help. Let’s go.
kharum.help village	The villagers will need help. Let’s go.
kharum.help village	The villagers will need help. Let’s go.
	
kharum.nomad wave	You are here! A miracle!  We await a more serious attack! Please help us.
	
kharum.nomad wave dead	Thanks to you we have survived and are safe, at least for now, but we have one more request... if you will.
	
kharum.retaliate	Please, go to where the attackers come from and stop them once and for all!
	
kharum.retaliated	We did it! Let’s tell them they’re safe now at the village.
kharum.retaliated	We did it! Let’s tell them they’re safe now at the village.
kharum.retaliated	We did it! Let’s tell them they’re safe now at the village.
	
kharum.talk to ran boo	Well done, thank you! Now only the final enemy needs defeating. Talk to our guest, please, a man called Ran Boo. He can explain.
	
kharum.ran boo spawned	So, you’re after the big robot, huh? To reach it, you have to activate an ancient device in the village here. Not easy, but if you’re willing and ready, let’s go!
	
kharum.lets go	Well you got guts anyhow! Now to find the power sources scattered around the desert and activate them. Lead the way!
	
kharum.found power source	There is a power source here. I am on it.
	
kharum.last power source	Now we have enough power. Let’s go back to the village and activate the device.
	
kharum.activating ancient device	Now stay back! I am going to turn it on!
	
kharum.ancient device activated	Wow it worked! Not that I, er, doubted it ... Anyhow, let’s go pay the big rusty dude a visit. After you!

kharum.kill Xelrad	This is what I call big prey. Now let’s kill it!
kharum.kill Xelrad	This is what I call big prey. Now let’s kill it!
kharum.kill Xelrad	This is what I call big prey. Now let’s kill it!
	
kharum.killed Xelrad	A glorious kill!
kharum.killed Xelrad	A glorious kill!
kharum.killed Xelrad	A glorious kill!

kharum.i kill you	So much trouble just to come here and be killed by me?! If that is what you want, it will be my pleasure to deliver it.
	
	
//// Corrupted Fields	
cf.open cages	Come on! Open the cages! I want entertainment!
cf.final battle-cf	Enjoy the moment, for this is your last battle!
cf.where am i	Huh?! Where am I?
cf.where am i	Huh?! Where am I?
cf.where am i	Huh?! Where am I?
cf.your minds	Your minds are mine!
cf.you strong	You are strong! I wonder how far can you go into my domain!
	
//// Esperanza	
esperanza.creeps	This place gives me the creeps.
esperanza.creeps	This place gives me the creeps.
esperanza.creeps	This place gives me the creeps.
esperanza.didnt we	Didn’t we kill him already?
esperanza.didnt we	Didn’t we kill him already?
esperanza.didnt we	Didn’t we kill him already?
esperanza.cant kill me	You can’t kill me, I am eternal!
esperanza.will meet again	We will meet again!
esperanza.we meet again	We meet again!
esperanza.mistake	You killed <i>me</i> but you left <i>me</i> alive. A bad mistake!
esperanza.ill be back	I... I’ll be back!
	
	
//// Renegades’ Hideout 	
rh.bow to me	Bow to me, slaves!
rh.got what u deserve	You got what you deserve!
rh.i was wrong	I... was... wrong!
rh.killed by slaves	Killed by slaves! How...
rh.it is dead	Whatever that was, it’s dead. One less threat.
rh.it is dead	Whatever that was, it’s dead. One less threat.
rh.it is dead	Whatever that was, it’s dead. One less threat.
	
//// Bridges of Trial	
bt.dont disappoint	I have been waiting for you for so long... Do not disappoint me!
bt.challenge	Finally, a challenge!
bt.victory again	Victory again... won’t this ever end?
bt.disappointed	Was that the best you could do? I am disappointed.
bt.can rest	Finally! I can rest!
bt.impressed	So, you made it this far. I am impressed! Now, only the final challenge remains. Good  luck!
bt.bites the dust	Another one bites the dust!
